32939,"I chose this one expecting a little bit more. I heard that the camera of this phone was good, but it is not as good as it could be. The best devices for great images are iPhones. Before this one I was using an iPhone 5S, so the difference is brutal. When charging, the phone turns so hot, and sometimes touchscreen doesn't work in certain zones. If you have an iPhone, believe me, this is going to be a disappointment. If you only need some basic functions, this phone works very well."
6880,"UPDATE (11/29/2014): Called and chatted with Moto five times over a period of 20 days, my replacement phone is still nowhere in sight. Different reasons were given. The last one is that I need to get another RMA and send in my credit card number again. Drop rating to 2 stars for inferior service. ORIGINAL: Cracks are showing up after 6 months of normal use. Cameras are not great. I really liked the phone. It is thin and it is fast. The plastic cover feels good. In fact, I dislike the cold and harsh feeling of aluminum used on my Apple products. The screen is reasonably bright and colorful. It is speedy and uses the stock Android. Not much bloatware. BUT, the side of the phone cover starts to crack in recent days. There are 6-7 cracks all over the side of the cover. The battery is getting shorter over time. Other than these, it has been a good phone. I need to get warranty service."
71860,"I bought this phone from Best Buy on sale and I freaking love it. I was using a Moto G5Plus and it started to get really Laggy. I heard of this phone earlier in the year when it came out and regretted not getting it. I'm glad I remedied that. It's snappy and everything loads fast. The camera is amazing for the price I paid. Low-light photos can be a little bit crap, otherwise the camera is good in all conditions. It receives updates regularly unlike my Moto phone. Also the Sony skin over the top of Android Oreo is just gorgeous. There are so many background options and ways to update the look of what you see on screen. Also incase anyone is wondering this Phone works on Verizon now! That was also the reason I did not buy it at first. I believe it only gets LTE service on Verizon but if you have AT&T or T-mobile you should get 2g'3g' and 4g in addition to LTE. I'd highly recommend it"
23725,Good battery life is the most impressive thing about this phone. Last two days with regular use.
76058,"I hate the curved screen. There is color shift around the edge, and the screen is always registering touches from just holding the phone. Otherwise the phone is fine, but too thin to hold without a case. I like the speed of the S10 over the S7, but the form factor of the S7 better. I liked the removable battery in the S5."
76136,Upon getting phone and plugging in to charge within 5 minutes it was burning hot.
7400,"The large display is nice, but the phone its self is very hard to carry. Easy to drop especially for someone with arthritis,"
64026,"In short, Every penny well spent, this phone have proven to be the real deal when it comes to considerate price for innovative technology. The phone has been working perfect from the time I have commenced using It to Now. For the price point it even packs a very great camera, 16mp and 2mp dual rear camera and a 16 mp front facing camera. Couldn't find a better phone than the Huawei p20 lite at this price point."
61038,I want to return for exchange. This unit won't let me charge with a cable. Gives me nothing but water sensor errors. It's never been anywhere near any water or moisture
7828,This phone sucks always says no service . I miss calls a lot because of it
76965,"I love this phone. The color is amazing (I got red). I'm using H2O wireless (AT&T out of allentown, pa) and it works great on the international version. I was worried about this but I have had no problems at all (your mileage may differ especially if you are in an area with limited or spotty coverage). The turbo charger is AMAZING! A 20 MINUTE charge gets you to 75% quickly and I feel I can get a good 2 days of moderate usage on a full charge. It has a nice heft so it feels quality. The screen is beautiful. It's a clean build with virtually stock android... no bloatware. I love the motoGestures. To put it on 'Do not disturb', I can simply set it face down. It just works. I haven't really used the camera, but if you watched any reviews, it is a bit more than adequate if not great. So, unless you are insta-famous... this is fine. I could not be happier with this phone. I was a micro-user (on a payperminute plan) using an AMAZON FIRE PHONE (remember those?), but due to a new job with a 911 center, I needed/wanted to upgrade and a major upgrade it was for me. The international phone for the g+ is also cheaper than the US G7... more bang and cheaper (but no warranty). I would happily recommend this phone to anyone. It really is pretty... and the color is awesome (not boring like all the other US phones. I watched a lot of youtube reviews so I knew what I was getting and they were all spot on. It's a great value phone with Oreo 9. How many other flagship phones don't have 9 yet?"
72795,"Huawei definitely make the best hardware , this one and the previous mate 10 are excellent phone , my main gripe is the software. There's a bunch of maybe apps and they throw in some others like Facebook which is annoying but given the storage isn't an issue. Main problem I found is if you're using Google service the native photo email and messaging app will get in the road where they will still act as defaults so to send a photo you need to go in to photo and send it from there instead of doing in the messages app , pure Android on these would be perfect The fingerprint reader can be hinky but the face recognition is quick although I'm not sure how secure it is . Bluetooth can be problematic but I've switched to a pixel phone and some of the connection problems still exist. Screen protectors can be a problem I've had them fall off when you drop the phone so it pays to have spares. Can't fault the camera but I did miss the dedicated black and white sensor that was on the 10. These are IMHO the best looking phones around but they are slippery in the hand so you end up covering them in plastic which is a shame"
21514,Received my phone it was wrapped in plastic like new. It did not come with headphones and the charger cord and adapter were not from apple but that wasn't a deal breaker. The phone started right up and as of today is still operating like new. Would definitely recommend to anyone who is looking for a new iPhone.
13137,Overall a good phone for the price. There is no way to get rid of unwanted menu icons and the phone call quality is not what I expect from Nokia but the phone is durable.
2476,BOUGHT THIS PHONE FOR MY MOMSO THAT WE COULD PLACE A SIMS CARD IN IT AND THAT WORKED GREAT. THE ONLY THING SHE DIDNOT LIKE WAS THAT THE SCREEN/TEXT WAS SO SMALL BUT SHE MAINLY USES JUST FOR CALLING SO THAT PART WORKS OKAY.
56515,"I was completely worried about purchasing a renewed unlocked phone. It came with Verizon still on the start up screen, but as soon as I put my AT&T sim card in, it switched right over. What a relief! Phone is in EXCELLENT condition. Charger is not Samsung, but that's ok. The S-Pen is brand name Samsung, and has some scratches on the end but I don't even care. The phone itself is gorgeous, and works perfectly ! Very satisfied with my purchase. I should also mention, there are no headphones either, but I still have the other pair from my other phone."
15922,"Its a great backup phone or for a first time Windows Phone user.. for the price I expected the performance to be slow but I stand corrected .. the Performance is pretty good. You will need a micro SD card though as it only has 4GB of storage. Windows Phone OS runs very smooth and the phone is compatible with Windows Phone 10!! The display is alright but its not very vivid with colors and its nothing like an iPhone display.. The phone is very comfortable in the hand. The camera is okay, it doesn't have a front facing camera or a flash. If you want a phone with a camera that takes HD video/ pictures this is not the phone. It is however a great phone for a new smartphone user and its pretty good for the price :)"
77734,Awesome for everyday use. Might be a little small to watch videos. Battery does not last long. Nice Cameras
71590,My unit arrived and looked to be brand new. Only thing I noticed was some small rub marks on the bottom back edge - probably from a case the previous user had. Other than that it's worked like a charm. Glad I gave the refurb route a try. Saved me plenty of money.
28765,"I love this smartphone, but there's always room for improvement."
196,Phone came with coupons from 2011-12 so phone is an older model. Not bad for $3.59
3623,Got an ATT phone despite the description saying that its factory unlocked. I need to send it but am traveling back to my country. This is so frustrating
12793,"I have had this phone for about 2 years and a couple other versions for the 2 or 3 years before that. I love this phone and the windows interface. I drop it every other day,and doesn't break. Super simple to use with the ability to put all the tiles I need on the face of the phone so I don't have to think about what I need and where to find it on a super small screen with super small icons like other phones. The photo to text, send contact to text is great. I regularly use a blue tooth and periodically use it as a hot point, and both work great. The camera was better than expected, and the lack of a flash wasn't as critical as I thought as it does well in low light. I don't take advantage of cortana, but works fine. The Here Map GPS app that comes with the phone works fine. The only negative is that I need a couple apps for my job that are only on android or iphone, and are not available on the microsoft store. The lack of apps will be the only reason I would switch from this phone after some version of it for around 5 years. I love it."
78038,Purchased this S10+ for my wife's birthday. She was so pleased... great value and another terrific Samsung Galaxy product.
30536,"Had issues with delivery through FedEx. They wouldnt leave it at my house so I waited 3 days to pick it up.. got it and seemed ok until I put my sim in and it wouldnt connect to ATT network. I called ATT to try to activate it but the employee said the IMEI had been marked as blacklisted, stolen, and unpaid so they cant unlock it etc. This has been a huge waste of time and energy and I should have listened to my instincts to NOT buy a phone on Amazon. I reported this seller and hope no one else has to go through this"
12564,"it is broken.. I bought an cellphone with screen problem, tactil its ok, but the image turn off and on quickly... I live in Venezuela and I don't have how to sending back for guarantee. I send a e-mail but no response. I hope others cellphone have been better."
19765,Worst ever. Got my package with only a note inside and not the item.
13784,"Bought this phone as a gift, can't really make too many comments other than the phone works as described by the seller."
3310,The phone keeps losing it's signal. We probably should have purchased a remanufactured instead of a used one.
72747,"I need it's business apps, which is why I bought it. The camera and other apps are great (I deleted the games - I don't play games on my cell), but they aren't really important for me. Battery life is fantastic which allows me to use this phone and computer almost all day and NEVER need a charge. For business, this is great!"
49378,"Even though this was advertised as an unlocked phone, it was not. It would not work with any local provider or even Verizon. There may be an exception through other companies, but for an ""unlocked"" phone, it certainly didn't seem like it. It's not as hassle free as you would expect from the description. It does make a nice PDA or mp3 player, though. If you're looking for a phone to use with your provider however, make sure it'll even work in the first place. otherwise, just go through your provider in question."
26581,"I love how quick this phone is, everything seems to flow pretty smooth. The camera is awesome, however the turbo 2 has a lot of charging issues. Mine took 15 hours to charge to 100%. Unfortunately I had to return it."
70133,im very upset i bought for my wife bithday then i set up everyhting finally its not working they keep asking me the screen lock passworkd which i never know
58467,My data wouldnt connect but my text and call would. They said it's the phone not the plan. Never again
22284,"This is an excellent phone. It is very durable, nice design and user friendly. I had the S5 Active that was great and when I got this S6 Active, they are miles apart. There is a better operating system and after a few software updates, it is just as good as the S7 Active. The only downside between the S7 Active and the S6 Active is the S7 has a speaker in the front and it gives you better sound...naturally. Other than that, this thing is a work horse! I have bought several more S6 Actives for the different lines I have with AT&T and for the rest of the family."
40192,"Phone looked brand new. clean and shiny. have only used for 4 days, but everything seems to work like a charm. price was excellent!"
77009,"I have no complaints, really. Motorola has done very well by combining a slick design with a reliable phone."
25073,Only defect I found was the notification LED. Apparently it's been an issue for quite some time but OnePlus still hasn't addressed this small but annoying issue. Apart from that I loved the phone... till it got stolen... >:(
53499,"It's refurbished but you would never know it's screen and everything was just perfect no scratches no scuffs and it came with a real Apple charger and headphones .Ordered from “BREED” is a leading seller based out of Miami, FL First thing I did was sign in with my Apple ID and password And set it up as a new device . Don't use Touch ID or passcode , what a silly waste of time, When I turn on my phone i want to get right to business, I don't want to waste my time by pushing buttons And stuff. Then I turned up the brightness and enlarged the text size Then I did an iOS update to 12.1.1 Then changed a kazillion settings to get it where I wanted it Like screen timeout ,Sounds and notifications and stuff, Maybe it's because I am so used to Android phones that i customizing it the way I like. It automatically downloaded all my stuff from my iPad mini4 , photos and pictures and Stuff from iCloud . I got the 32GB model and I still got 25gb left free to use. I bought 50 GB of iCloud storage for $0.99 a month well worth it . I have a Moto X 4th generation and a Huawei Honor 5X unlocked smartphones,and a bunch of Blu Studio phones in drawers “junk drawers “. And this “iPhone se “ is just as fast as all of them . Popped in my nano SIM card from US Mobile out of my Honor 5x phone and started making phone calls right away “beautiful “ , No settings or anything that had to be adjusted. Battery seems great so far playing videos and everything, screen at full brightness Update later . ( Day one ) So far very happy with this purchase will update later ."
55068,TRUST ME!! Then again I'm 75 yo & after further review I'm changing my 1 star rating with some reservation to 2 stars. Guess what? I still like it! :-)
31127,The picture shows an AT&T phone. I was given a Verizon phone. I want AT&T phone. I haven't tried the phone yet. I hope it works.
24408,I love this phone! This seller even directly contacted me by phone to be sure that I was satisfied with my purchase.
32092,Ordered this phone with the understanding that it was a GSM (Cricket) compatible phone. After activating it I discovered that it is actually a refurbished Sprint phone and works on CDMA. This means I can't get any phone calls to go through. I have had my service provider trouble shoot it to no end and will probably have to return the phone. Phone condition was otherwise good for the price. The body is in good condition and the only signs of use are on the home button where you can see two large scratches.
36238,Great company. Good phone. I will buy another one for my family.
43476,Purchased phone and tried to get it setup at a Sprint store and was informed that the phone was tampered with and is NOT compatible with the Sprint network.
18386,"We've had a land line with CenturyLink for 13 years. Over the last 5 years it's worked about 75% of the time. I don't really like cell phones, but enough is enough. My wife has a similar Samsung Galaxy, so I got this one, called AT&T, They over- nighted the SIM, plugged it in and I'm talking. So far the battery seems to last forever. If you have big fingers a stylus is necessary. I would recommend this phone for anyone that doesn't have to have the biggest and latest."
69246,"Great value!!! 1. Two sim cards that can use simultaneously, conveniently and smoothly (especially you need to travel abroad frequently, that would be definitely a Must product with you). 2. Durable battery (only need to charge once a time per day. I am a heavy user in online stuff). 3. To some extent, the new Android one system is quite comparable to iPhone. 4. Delivered with a clear plastic phone cover (that is so thoughtful!). p.s. the only minor cons is that there is no earphone coming along with the phone set."
54837,I love the size and the physical number buttons. Phone was easy enough to figure out. There are limited functions and one that I miss is the option to increase the font size. Otherwise the phone works great as a basic cell phone to answer and make phone calls.
44480,"I recently purchased this Samsung Galaxy s5 as a replacement for an older 'basic' phone that will soon not work on the new Verizon network after the first of next year. As I already owned one Galaxy s5 and was very happy with its performance I thought I would buy another. This phone so far has been great. The condition was as new as if I had gotten it out of a new Box and it was up to date software wise also. I put it on my Verizon account and it seems to work very well. It does come with a charger and cable (Side note- the cable is for charging only - not data transfer, but that really isn't an issue with the phone and still well worth the price) I did talk to the seller about the cable issue and they were great to deal with and I would buy another phone from them if the need arises. So far the phone works well with wifi, and my network. the speaker on the phone works great for calls as well as the microphone - overall it is a great product so far!."
68915,"This was to be an UNLOCKED phone and when I tried to get it set up with Verizon-I wasn't allowed. I was told it had to be AT&T. I have to go outside to both make and receive a call and no text unless I am outside. How do I return this phone, due to it is not useful."
56598,"I've had this phone for almost a year at this point, and it's basically unchanged from when I got it. It's fast, it's dependable. Well worth the cost."
17824,Being honest I'm having a ton of problems with this phone but the quality is good but not as I expected it is cheap for the quality but I wouldn't buy another one
71861,"The phone works as a phone OK, but the camera is buggy! The camera will over heat in 4K video and shut off. The camera will error out in HD video when pushing the record button 1 out o 5 times. I have missed important shots. The HD video camera will not stay focused well in many situations."
55071,Probably a nice phone but with the upgrade to 4g by the cellular companies the phone could not reliably connect and make calls. Had to return it.
73523,It didn’t come in it’s box it was wrapped in paper and no headphones I still haven’t tried connecting it to my server but I’m not happy with my purchase and it had a scratch on the back so it’s not new I’ll keep ya updated It's working fine good phone I will recommend
13684,"This phone is exactly what I wanted. Arrived on time, perfect."
42463,"First off it is on Prime but it took 6 days to arrive which isn't very prime so we didn't start off very good, I bought this phone to use on the Straight Talk network so I needed an unlocked phone, it was advertised as ""unlocked"" but didn't say anything about needing a SIM card so I was proactive and ordered a Straight Talk SIM card just to be safe and that was a good thing as the phone didn't ship with a SIM card. After spending an Hour and twenty minutes on the phone with Straight Talk trying to activate the phone I found out that this phone is NOT unlocked for use so this phone will NOT work on Straight Talk!"
53775,"Bought this used for $270 on Amazon. Owned the phone for less than a week but I'm very impressed. (Probably new-toy syndrome.) Too easy to set up with Ting... just dropped a 128GB microSD card and the SIM card into it. Initial setup was, as always, easy with Android. I flashed Android Pie onto it with no issues, although I had to do it with ODIN as opposed to Smart Switch or Kies because I found out Samsung disabled this feature from both programs (server-side, so older versions will not work). It is physically a very sleek phone. It also feels very sleek... and slippery, and a huge fingerprint magnet. After I cleaned off my grubby paw prints, I slapped a case onto it. The screen itself is rather large and very generous with space. I have smaller hands but I can still comfortably (barely) use gesture typing with just my thumb. I am not a stylus user but trying... the stylus fits neatly into its slot at the bottom right of the phone. The phone's performance is... well, brand new. I can't get it to lag (yet). I'm not a super power user and like to keep things simple, so I haven't tested any crazy 3D gaming yet. (I've included my app list below, just to give you an idea of what I run on this thing.) It's nice to finally have a phone that keeps up with me. The camera is beautiful so far. I haven't used it as much as I want to yet but I have faith this will be better than my broken camera on my S7 Edge. Plenty of options in the app... nice, sharp, and colorful! Call quality seems fine... not tinny, not terrible, good to go. Network connectivity to WiFi is as fast as any of my laptops. Haven't tested tethering or anything like that yet. More to follow as I play around with it! - - Gmail - Disa - Hangouts - WhatsApp - Google Maps - Here WeGo - Adobe Lightroom - GoPro - Google Photos - SJCAM - Google Chrome - Netguard - Tasker - Timely - Aldiko Classic - Amazon Kindle - Amazon Music - Dropbox - Duolingo - YouTube UPDATE 20190906: Still pretty happy with the phone. Delved into VR use... it is pretty nice considering the battery drain while using it isn't as bad as my Galaxy Edge S7, plus it is fun to use! (Don't bother with the 2016 version of the Samsung Gear... it will mar any screen protectors and it is a super-tight fit with the connector AND the other side.) No lag so far with what I've used for Oculus Apps. One thing that drives me nuts is that I tend to take unintentional screenshots by just trying to hit the Power button or trying to lower the volume but reaching a bit too low on the left side. Pretty long battery life. Lasts me a full day and has more than 30% left with my normal use."
79765,"Great phone! Had a little trouble getting it activated, but it works great for the price. I'd definitely recommend."
59852,"Great phone, less expensive than getting a replacement phone thru carriers insurance plan."
5266,"Nice little smaller than expected, other than that great phone, great price, new in original box, lil disappointed.......in the size."
50778,"Extremely good, reliable phone. System updated to Android 9 (Pie) automatically and have lots of space for all of the apps I have.I do have far too many but love tinkering! All of the apps work well. I do miss having a dual SIM phone, nowhere to keep my other SIM. The absence of an SD card slot has not been missed as the memory appears adequate. Battery life is very good- especially with the new 'dark' mode. The phone is meeting all of my expectations of a smartphone so far!"
