4856,"This is my first smart phone, and I am very pleased with 99% of the technical specs on the phone. The phone is incredibly user friendly, THE VIDEO AND PHOTO IMAGING ARE BY FAR SUPERIOR TO ANYTHING I HAVE SEEN IN NYC (BEING SURROUNDED BY PEOPLE WHO CAN'T LIVE WITHOUT A SMART PHONE)ON ANY ANDROID OR APPLE DEVICE. The Battery Life is also significantly better. I can't compare it to the specs on the Galaxy IV because that was a higher price range, but compared to the Galaxy IV & the Apple I5 this has 32 GB of storage! Based on what I have read it is 720 HD resolution for Netflix and YouTube. The Galaxy IV or Apple I5 are both 1080p. For me personally this is not significant for a five inch screen. It records in 1080 HD and can be connected to your TV via an HDMI cable. Although the music app is Nokia Music Tunes, you can upload the majority of your I-tune library via a Windows 7 or 8 PC. The only negative for me regarding this phone is the lack of Apps primarily regarding Video application such as HBO GO, Showtime Anytime, and Amazon Prime video watching. THE REASON FOR THIS IS THE PHONE DOES NOT SUPPORT ADOBE FLASH PLAYER, hopefully this will change in the near future. I WAS NOT MADE AWARE OF THIS PRIOR TO PURCHASING THE PHONE AND I AM ACTUALLY SURPRISED IT DOES NOT SUPPORT IT. IF WAS AWARE OF THIS ADVANCE IT WOULD HAVE PLAYED A MAJOR FACTOR IN MY PHONE CHOICE. SO FOR SPORT ADDICTS DURING PLAYOFF TIME THIS PHONE WILL NOT HELP YOU AT THE MOMENT. Another MAJOR PLUS if you actually use a smart phone in Business; is that it comes with all Microsoft Office applications, Excel, Word, Outlook, Notebook, and Power Point. If you decide to get this phone I highly recommend you attain the phone here or at Best Buy, a Verizon store or Verizon online will cost you double which is simply not necessary. When I saw how it was priced online, here and other sites, I was disgusted with Verizon. I was eligible for an upgrade, but the only difference in the end between myself as an existing Verizon customer, and a new Verizon customer (the service as a carrier is superior) was a mere 5 dollars. I hope the better business bureau looks into Verizon wireless, because the reality is for existing Verizon customers, it is a bate and switch scam, I was content with my ""dumb"" phone, and their email to me that I would get an upgrade at a discount was simply a means to get me into the store. I could have upgraded my device here and saved A LOT of money. that being said for 50 dollars you are getting an awesome phone that I would put up there with the I phone 5 (with much better battery life) and any high end Android Device. In summary Great Phone- if you are a TV addict you need a Droid or I phone at this juncture and this phone is not for you. As far as Verizon DO NOT buy it at verizonwireless.com or in at a Verizon retail store you will pay double. Otherwise you can see for yourself as the specs are clearly outlined by Amazon, and it does import most music files from I-tunes."
75552,"What can I say that hasn't already been said about the phone. It's a top tier phone with the best screen on the market. The cameras take amazing pictures and the three lenses with their apertures give you a lot of flexibility in photo taking. The battery easily lasts a day so most people should be fine unless they're heavy power users. But even for those folks, the phone does charge up really quickly. I also love the speakers on the phone. The two channel sound with Adobe Atmos sound really create the illusion of surround sound (within reason. This is a phone after all.) I picked up the phone during prime day when they were selling them at a $300 discount so for that price, the phone was a no brainer for me. Upgrading from a Galaxy S7, this was a nice leap for me. I don't know if I would recommend the phone at $900 but that's mostly on principle. I don't believe any phone should cost as much as a midrange laptop. So, if you can pick this phone for a reasonable price, I would highly recommend it."
81311,"Estoy muy satisfecho con este teléfono, me compré dos y hasta la fecha no he tenido ningún tipo de problemas con ambos"
3229,"I replaced my droid incredible with the razr M - I had the incredible for 2 years and it never crashed completely even once, I've had the razr m for a month and it has crashed twice - requiring hard reset - pretty much the exact same apps loaded so I really don't think that is the problem. additionally the sound was terrible for about a week - happened suddenly, I made a call and it sounded like a blown speaker in your car sounds. all calls I made after that had the same problem. I was going to bring it by the verizon store and trade it in (or whatever) but as anyone knows who goes to a verizon store, you need to have at least an hour to wait to be even spoken to and I was busy with work so I didn't have time to go and in about a week it suddenly improved. I'm guessing that problem is going to come back. I like the phone a lot otherwise but I think it is produced more cheaply with cheaper parts than the incredible I used to have. I'm going to keep it and it's likely any other droid produced today is going to have similar problems so why bother frustrating myself with trying to take it back but I'm definitely disappointed."
80146,"I just over love my phone, just what I was looking for. Reasonable price love the camera, lightweight. Love it"
29211,I broke my phone’s screen and needed an immediate replacement. It has been a few month now and it has been working just fine. No complaints.
14619,"Not bad for a used phone. It looked just like it came from the box. This phone is not top of the line, so it was perfect for my mother who wanted a large screen with not too many bells and whistles. What a great buy, refurbished products fulfilled amazon in my experience are always top notch."
45210,"I purchased a refurb unit from Blutek. I am thoroughly satisfied. The display glass is flawless and the battery is at maximum capacity. It came with an aftermarket power adapter and no headphones. Besides that, my unit is basically brand new. Highly recommended buying through Blutek."
73276,"This is my best investment also now the price may drop a lot because of USA war with China, but still highly recommend to friend due to the good quality of camera and battery life."
70307,So far very happy with my new Nokia phone. I have had it for a few weeks now. My first Android. I couldn't see spending a lot of money for an iPhone so I thought I would give it a try. I like the fact that AndroidOne was used so that Google updates will come faster including security updates. The new os (pie) made it a bit better as well. I have the 64gb model and added external SSD but haven't really needed that yet. The only minor downside is the very slippery case but that can easily be fixed with a protective case and I haven't bothered to get one yet.
35766,I received my s7 today. I charged it and after it was charged it I found that it discharges at a very quick rate. Ten percent in let that ten minutes. 100° to 90° in ten minutes without use!!
14702,"I really liked the galaxy mega because I have had one before like in 2015 and when I ordered this one I figured it would be great, but every time I'm on the phone talking to anyone , my call drops where I'm at home or out and about. The Internet goes off & on by itself. When I turn on the GPS it doesn't work. It tells me that I'm off line, so if I needed directions I would be screwed. I can't even download cash app on this device or my mobile banking app for my bank & It won't even pick up on WiFi in other places when I try to use it like if I'm at a restaurant or something. I tells me that I'm off line & to try again later. With my other phone that I had I didn't have this problem. I didn't have any problems. I only got this phone because I mistakinglly dropped my phone for the first time & my screen was busted & cracked, but my phone still worked but my screen was just cracked."
13979,"hi good evening .. I am writing this time to report that the phone which will buy the 31 December 2011, I came to my country Venezuela on Saturday 25 February, and since then from the day Tuesday started just 3 days to submit failures .. the cell phone just restarts, hangs on and off .. I would like to know what happens .. I await your prompt response"
8486,"This is a great phone. I love the big screen. The phone is fast, which is very important to me since my last phone had a very long and annoying lag time when I tried to make phone calls. Apps run quickly. The camera takes nice pictures. A couple of annoying things about it are: 1) The audio volume rockers are directly opposite the screen on/off button, which results in many unintentional presses that change the volume when trying to turn off the screen or turning off the screen when trying to adjust the volume. 2) There is no way to turn the sound on and off from the lock screen. Also, the rocker switch doesn't have any effect with the screen off or the lock screen on. To silence or un-silence the phone, it's necessary to unlock the phone and then use the volume rockers. 3) The video recording software freezes often."
82335,"I got this A70 for my mom after a disaster with a Samsung Galaxy S8 from straight talk there 4G did not work, So I brought it back to Walmart, now I wish I had just bought it unlocked to begin with. The camera in it is so amazing, I had it when it first came out. I just want to get my mom a decent phone that she's happy with. I can't complain regarding the unlocked Samsung A70 for the price the screen is bigger brighter and more luxurious looking than my Samsung Galaxy S10 Plus! It's really beautiful! On top of that it came free service! Three months of free phone service 8 gig of high-speed data by Mint Mobile no strings attached, through walmart online. The only negative part I can find is camera quality! If you want top notch landscapes or selfies this isn't the phone for you. That's why I got the Samsung Galaxy S10 plus, Landscapes and night shots are very important to me. I was expecting the A70 to be pretty decent because of the 3 rear lenses. Just the way it looks and feels I really thought it would take real good quality pics. Even with the newest update says improved camera quality and included a new night mode like the S10 Plus has. The pics lack the proper color saturation with selfies especially. Landscapes are ok as long as you don't try to zoom at all. I'm not sure what purpose the three lenses serve, or if they're there more for show like a value phone copying the S10 Plus. I guess I have 15 days to decide, if my mom is unhappy with the camera then I guess I'll be going with the unlocked S8 plus. But I have to say the 3 months of free service and 8 gig of high-speed 4G data was a huge highlight to buying this phone!"
71491,"Really like the phone. Everything is good - speed, camera, feel, display and so on. Did not like ads in system apps but there is a way how to turn them off. But after several weeks of using on T-Mobile network unfortunately often calls drop and nobody could reach me on the phone sometimes. I bought from different store, so I'll see other options..."
65023,"I found this was a perfect upgrade to my S6. I couldn't be happier. no buyer's remorse. the dedicated fingerprint sensor is effective and fast, the earphone connector is priceless. Samsung will lose me if it's not brought back on my next upgrade."
42074,I got an off brand charger but as far as the phone goes it appears to be the same as a brand new one. I may order one for the wife
54997,"This is a great phone. It does come with some 'apps' installed including twitter and facebook and you have no way of uninstalling these. I saw this as a downfall of the phone because I got it to go off the grid. But the 3g makes it so slow you wouldn't want to use data on this phone anyway. The bluetooth connects to my car better than my old smartphone. A great way to disconnect and control your data consumption. My mind feels clear with having this phone rather than having the constant need to look at my phone, I find myself forgetting about it for hours at a time. Strongly recommend this phone."
71095,This phone does not keep a battery charge long and keeps kicking me off of Bluetooth not recommended bought twice two of them and they both did the same thing
74207,The phone does so much! I The finger print scanner is spot on amazing. I was concerned that I wouldn't like the size but I've gotten used to it & it is an excellent phone especially for the money! It is an amazing bargain. I & goodnight recommend the phone.
45340,I love this phone!! It’s quick and works perfectly for me. I’m so happy with it
42705,Very good phone. I thought they would come with headphones though
46344,"The camera is absolute crap, but if you download an app, using THAT with the camera works well. I dont understand that at all, but... whatever works. Battery lasts forever. Tough phone. Pleased with my purchase."
4241,Great purchase! Exactly what I ordered! I got it really fast too & had no problems getting it turned on at Verizon!
76500,A great phone for the money. Camera is excellent. I had a g5 which was a good phone. This phone is better
52141,"I have never enjoyed a phone more. The storage issues were erased with a MicroSD card. I NEVER have battery anxiety. The phone has truly lasted me over 2 days between charges. Now, I think the camera is just fine, but if you measure your worth on Instagram, maybe this isn't the phone for you. I've owned Pixels, Galaxies, and iPhones and the MotoE4 Plus, has served me better than all of them. Oh, BTW, I got it for $115 on the Sunday after Black Friday. Not the best deal ever, but close. Can't wait for the E5 Plus b/c I will be getting it."
53933,"el celular a los 5 meses presentó problemas en la pantalla, y ahora no carga, quiero un reemboloso o un cambio"
14228,"Becomes a memory hog after few weeks of usage. The phone didn't come with a charger, even though it came directly from Amazon."
25336,"Samsung Galaxy S5 SM-G900T GSM Unlocked Cell Phone, 16GB - Black (Certified Refurbished) Phone is looking good but performance too bad interms of battery and phone functionality"
22534,I love my s6 active. I've had it for several months now and just got around to reviewing it. It is everything that it was described as - very durable and functional for an active -busy - rough user... I would absolutely recommend this phone.
18431,"Bought this phone a couple weeks ago from Amazon, got a plan from AT&T and inserted a SIM, and the phone it has an ancient version of Android OS on it, preventing some apps from installing. It had Lollipop (version 5.1) installed. I needed 6, so I tried with System->Check for updates and it said ""Software is up-to-date"" and would not update the OS. There is a Marshmallow Update app on the desktop I launched and after going through a number of screens it finally says: ""ERROR!!! Your Device Is Not Compatible"" I contacted AT&T support and they told me I needed to contact Samsung support. I did, and after waiting for 20 minutes on hold and another 30 minutes on the phone, following various sets of instructions, all of which fail, he said I had to go into a Best Buy and bring my phone. The nearest Best Buy is 3 hour drive for me. So he looked up other stores that have Samsung upgrade tools and there was none closer. So he finally submitted a ticket and then send me a support authorization to send my phone to Samsung so they can upgrade the OS and send it back to me. I probably have to pay for the postage as well, though I don't know yet. So unless you want to live with a phone that is on Android 5.1 (Android 7 is already available now), and never be able to upgrade the OS without taking it to a Samsung dealer or sending it to Samsung, I recommend you do not buy this phone. I should have bought it direct from AT&T but wanted to save a few bucks. Dumb decision. My bad. And Amazon's fault for selling phones that are very old without first upgrading the OS. And Samsung's fault for not being able to push an update."
53577,Ordered a black se for my dad. But this is what I get. Give me money back.
80873,Don't know this was the international version. It's bounces from lte to edge randomly no matter what TMobile apn i use. Anytime i make a phone call it's drops to 3g which i never noticed on any other unlocked device i had in the past.
25890,Item was listed as new but I'm pretty sure it was refurbished. My phone worked amazing for 2 weeks. Then one day my screen would start flashing every time I locked my screen. Seller refunded my money upon return.
11254,Great phone and the battery last a long time on a charge
35104,"So far, after a week, everything seems in perfect condition. I am very happy with my new phone. Camera is a delight, batteries are strong, and I love the size of the SE."
73513,I love this phone I did alot of digging to ensure this device is factory unlocked and I am happy that it is. My phone has this weird speaker thing where the balance shifts all weird but I mostly use bluetooth headsets so it's fine and other than that I love this thing
6201,Amazing battery life and good display. Bought it for my aunt. She loves it Elderly will prefer the huge screen note 3. http://www.amazon.com/gp/product/B00F2SDM00?ie=UTF8&camp=213733&creative=393185&creativeASIN=B00F2SDM00&linkCode=shr&tag=swiclu-20&linkId=RCMIBKLNN5BNUD5D&refRID=04754BBX2BT8DEB8YB50 Love android!
914,"I just bought two of these and tried to activate NET10 service to use the Verizon CDMA network. I turned on the phone and see that it says a service from Tracfone. I read these reviews and do not recall anyone mentioning this. I absolutely do not want Tracfone. I am really upset about this right now. Best of all, the activation and phone plan I paid for did not get completed because the Tracfone server was too busy. Otherwise, though, the seller described the product accurately and the expedited delivery I requested occurred as scheduled as well. The seller did a great job. Too bad the product appears to be a bait and switch and money for absolutely nothing in terms of the ""service"" plan."
25346,I've had some issues with it haven't even had it for 4 months yet and already having issues just spend the extra money to buy a new one
2988,"UPDATE (May 2016): When I finally switched to an iPhone last month -- after the THIRD Motorola DROID RAZR M died in a two-year period (basically every 7 1/2 - 8 months, like clockwork), the Verizon tech who was helping me said this model comes back ALL. THE. TIME. Buyer beware.....(End update) I have loved my Motorola Droid phones -- they are the only smartphone I have ever had, even though others have tried to lure me over to the iPhone, but this is ridiculous. I got my first Razr M in April of 2014, as an update when it was time to renew my contract. I liked that it was thinner than the phone I was replacing (a Droid 4), and it seemed to be a great phone overall. Fast forward to January 2015 -- right at eight months -- and it would not even turn off, but neither would it turn ON. I had been having to reboot it multiple times per day, as it kept freezing. One night during a reboot, it got stuck on the start-up screen with the red glowing symbol...and it stayed there until the battery died. If I recharged it, the same thing would happen. So since it was (thankfully) still under warranty, Verizon replaced it. That was January 2015. By early July 2015, I was once again rebooting my phone multiple times a day. Text messages were not always being delivered, the phone did not vibrate for incoming calls when it was on vibrate (so I missed a lot of important calls), and it was generally undependable. I took it in to Verizon and they examined it, telling me to remove a few particular apps and do a factory reset. Ibdid, and within a week, I was back because that had not fixed anything. So in late July 2015, the phone was replaced AGAIN. It is now the end of November -- just four months later -- and this third Razr M is driving me bananas. It reboots itself randomly (sometimes several times a day), I have people telling me they get the same text from me more than once , I find others have sent me texts I never receive, it once again does not vibrate on incoming calls when I have set it to vibrate....I am just DONE. I can understand a phone here and there having problems, but three models of the same phone in less than two years that cannot make it more than eight months before dying? That tells me there is something wrong with the overall design."
62513,"Very poor reception at my home. Much less than my old Iphone. I had to change services to use the nearest tower, and then add a booster for it to work. Even then not a good signal in some of my house areas."
45111,So far my phone is working perfectly fine as a new one thank you so much
66169,"Great looking updated to Oreo out of the box beautiful baby blue metal back great phone all around liked my g5 LOVING MY g6 plus BX, NY"
55097,Just what my daughter wanted. She is very happy with it.
30177,Looked like good condition the back had a piece slightly sticking up and battery life is kinda poor. Without touching it at all died 13 percent with in 2 hour time frame
62999,"I have been a loyal Samsung phone person since the S3. I have had 2 S models, 2 different Actives and 2 different Notes, the most recent the Note 8. Two things bothered me about the Samsung. First the battery life kept getting shorter and second, the Samsung Software that was all over the phone. I made the decision to go to a smaller phone and the Sony Experia XZ2 Compact was the smallest flagship I could find. This phone addressed both my Samsung complaints. First of all the battery life is far and above better than Samsung. I think this is because of the combination of the smaller screen size and fewer apps running in the background. I am a heavier user and I still only run down to 40% by the end of the day. Second is the android experience. This is much more like the Nexus phone I had a few years ago. It doesn't have Bixby or Samsung cloud and other apps running in the background. It lets you use what you want and doesn't force anything else on the user. The fact that this phone is a 5"" model makes it pocket friendly but the screen is large enough to be functional. It was only a few years ago that this was the standard size before the Phablets took over. I recommend this phone and can assume that the full size version is equally as good."
1284,"Excellent experience all around. Delivery was quick, everything came as advertised, and the phone is terrific. If people would get over their Microsoft hangups they would see what a great platform Windows Phone 7 is."
2495,"I bought this phone to be a simple, easy to use phone to replace a slider with a menu that was difficult to navigate. You don't have to use the SIM card for the prepaid plan that comes in the package. I just took the old SIM card out of the old cell phone and put it into this new phone, and that was all it took to switch the service for the old cell phone number to this phone. Something awesome that discovered is that is phone changes on a standard microUSB cable, so if you already have a Kindle charger, it will work for this phone also! It was very easy to add items to the ""Go To"" menu for quick access to make it silent and to check voicemail. The only thing I don't like about this phone is that it doesn't have a screen on the outside. When a call comes in, you have to open the phone to see who is calling. Not much of an issue for me. It does have a default setting that when you open the phone during an incoming call, you can choose to answer or decline the call. It does not automatically answer when you open it. Nice compact phone that slides easily into pocket or purse! I have been very happy with it!"
32175,"Very nice upgrade from my other Samsung cell phone. Samsung brand has never let me down and with the purchase of the s7 its track record is still intact .Phone looks great, video plays beautifully one it and pictures are awesome. Best thing is was as described as the seller had said , when I got the phone it was new but thanks to amazon I didnt pay new prices so it made the phone even nicer. I really like the little feature of the time showing on the front of it so one doesn't have to turn on phone its self to see the time. The only thing wrong I see with the phone isn't actually with the phone but the fact is I didn't get headphones or the sim tool either , but those are not deal breakers. I do not use earbuds any and I was able to use a paperclip to open the sim card holder. Friendly heads up to metropcs users yes it does work on it. Because it is my carrier and when I took it in they had no problem switch it over . So over all very happy with the purchase."
8798,"Brings blows and dribbling in chrome but what I care about is the system, we will see that it continues to work in a few months."
37340,I absolutely love this phone and mainly for the camera possibilities. Do not hesitate to purchase a phone outside of your AT&T dealer. Get what you want. I wanted small (fits in pocket) and great camera. I got both.
70885,"Amazing. The stylus is a game changer and has become a tool for me as an artist I simply didnt think could exist. I am addicted to drawing on it. The native apps are mediocre as per usual but 10$ on autodesk sketchbook pro on this phone is a dream, you can draw at 10000 x 10000 pixels with layers and export to PSD, print out at 300 dpi in huge dimensions. Was looking at the note 9 and possibly 10 but the price to value ratio is clearly with a refurb S8, no regrets, other than wanting to draw on this phone forever."
