60538,"Had the phone a little over 2 months now, after my Nexus 6P battery issues forced the need to purchase a new phone basically immediately. I wanted something unlocked, and didn't want an iphone or Galaxy, which leaves little options at the regular electronic stores, so I one day ordered through Amazon (which went great) something I thought would match my needs the best. Phone itself is great looking, great size and weight. The fingerprint scanner on the back is one of the most responsive I've ever used, and the optional gestures using that work well too. The general software it comes packaged with are eh. I prefer stock Android, so am running Nova Launcher to avoid EMUI as much as possible or to make it at least feel that way. There are a lot of weird ticks with this phone, and there aren't a lot of third party apps that you can use that integrate smoothly. The stock dialer is ugly and messy, but nothing else really works I've tried so I tend to mostly make calls via Google Contacts or by searching for a phone number in Chrome etc. The always on screen notifications are pretty spotty at best, and the notification led is not very customizable, and even if it was the brightness of it is so minimal I can barely see it in regular light. This means I tend to not see important texts or missed calls until much later most of the time, which is pretty obnoxious. I never realized I liked having the always on screen as much as I do, but since half the time it doesn't show the text or missed call icon, even just using the stock apps to send/receive them it really limits the usefulness of this feature. The stock camera software is pretty bad, and the regular color camera just takes ok pics. There are a lot of options that ""camera people"" will enjoy, but having come from the 6P and it's way ahead of everyone camera to this, has been disappointing. If I wanted to tweak settings like I was using a DSLR, I would literally just pull out my DSLR. The B&W camera however is insane, and takes amazing pics, but as I generally only grab pics with my phone for social media stuff or reminder lists, this is a little useless overall and just feels like a gimmick. I've tried a few third party camera apps, but again, the integration is spotty at best, and nothing really seems to make anything better than the not great stock app, so it's a wash. Updates from Huawei appear to be nearly non-existent for the US model, for what appears to be a myriad of reasons. This isn't the place to get into any of the political reasons or how I feel either way, but the lack of updates or hopes of one is pretty wack. EMUI 9/Pie have been rolling out to different international versions of this phone for almost 2 months now, and I'm not even on 8.1 yet. And in the 2ish months I've had the phone now, I've only received 2 security updates. For a flagship phone less than 2 years old in this day and age, that's pretty unacceptable. Especially coming from the 6P, which was getting updates up until December 2018, this has taken some getting used to. The battery is definitely the best part of this phone, with some notes. I've tweaked the hell out of every option I can to get the best settings for me, and how I need my phone to function. That means I override the AI as to what can use the phone when, and what apps have access to what options etc. It's dumb I had to spend hours doing this, but it was worth it. That said, I rarely find myself charging this more than once every 48 hours or so. And when I do, it's almost never to 100% (not because of any rules some blog might have written about for battery optimization, just I haven't needed to), and I still usually get 2 full days out of it. Goodbye are the days when I leave the house with the phone only at 30% and have that nagging feeling in the back of my head all morning that I need to find a place to charge it up. That alone makes up for many of my other complaints with this phone, because I've had some amazing phones over the years that could barely pull 8 hours on a full charge with how I used them, but this thing is a beast in that department so put that in the pros column for sure. Overall, I doubt I would recommend this phone for most people. People wanting an unlocked experience, with the option to customize your rom or any of the other perks that comes with it, forget about it. If you're literally just trying to have a phone you can swap providers with easily, there are better/cheaper options. EMUI is far too invasive and lacks basic options many of us are used to if you've ever used stock Android, iOS, or any flagship Samsung phone, and would be pretty frustrating to use for someone who isn't a phone nerd, but said phone nerd would be pretty turned off by the limits of this phone so why bother? And as there's basically no third party ROM support for this phone due to many issues, the viability of this phone once official support is cut off means this thing is already pretty obsolete. I definitely regret my purchase, and know I could return the item to Amazon even now because their policy is pretty robust in that regard, but I don't think I'd feel right doing that. So for now I'll ride this thing out, wishing the 6P was my forever phone and had a new huge battery with updates, and plan to replace my Mate 10 Pro by fall of 2020 when I am sure it will be a paperweight by then."
69328,"The phone looks advanced and fancy, the seller is cooperative too.."
2438,I don't ask for much with a cheap prepaid phone like this. It does everything that it needs. I'm satisfied.
19434,"Great phone, still had factory plastic on the inner screen."
77108,This phone is awesome but I'm having a problem with not receiving calls. Reason I gave it 4 stars. I have to keep restarting the phone. Would love to be able to figure out why it's doing this but can't figure it out. Features are awesome & it's very fast! Nice size! It's narrower then my old phone & easier to hold with 1 hand.
1270,"Phone keeps restarting after five minutes of use, as doenst come with warranty i just bought the most expensive paperweight bad product"
13733,"I've tried two of these now. The second one I made sure was advertised as ""NEW"". The call quality was horrible on BOTH. It constantly cuts out during calls and makes me sound garbled to the other party. Had this phone actually functioned as a phone I would be giving a 5 star review, all other aspects of it were excellent. Unfortunately now I have to look at other brands because I can't afford an s7 or s8. Such a disappointment, my last 3 phones have been galaxies."
1174,"The phone randomly restarts, Bluetooth does not pair, it freezes up 2-3 times per day. Battery life is <10 hours. Samsung support is completely worthless."
82010,Wife loves the phone. Big upgrade over prior androids.
22984,"I lost my money when i bought this for my brother. And when he tried to connect it to his service provider it was still locked and under an account that owed thousands of dollars. Not happy at all with this Amazon, not only was i robbed of my money, i accidentaly robbed my brother of the joy if having the one gift he's wanted for months."
18432,This phone lasted me about 6-8 months before the battery burned out along with some really expensive parts as in what I paid for the phone itself . The phone was perfect for me but I wouldn’t buy refurbished again .
16132,"Just got this phone March-2015, it's Made in Vietnam instead of Made in China, not sure if that's better or worse. Anyhow, I found out it can't read my class4 micro SD card( the card works fine in other phones and card reader), not sure if it's compatibility issue or the phone's SD card slot is broken. I will try some other micro SD card later on, a class 10 maybe. Pro: inexpensive Con: 4GB space can't really do much when it can't read SD card (Fixed). I was expecting lumia 530 has at least the same amount of internal space as Lumia 520 (8GB) , but nope. For almost the same price, get Lumia 635 instead!!! Update- after a few days of playing, finally got it to work - solution is simple: just freaking reset (Setting--About--reset) the phone while the Micro SD card is in place. Before resetting it, I tried with class 4 /10, Sandisk and other Micro SD cards, with NTFS/FAT32/exFAT file systems..anything that I can think of, it just did not work . with NTFS - it says ""format require"" - hit format- "" SD card format failed, please use other SD Card"" with other FAT file system - ""SD Card not found"" Crappy SD card format solution / programing, wasted hours of my time, still 2 stars."
16848,"Bought this for mom. She loves it. Screen had no scratches whatsoever. Everything worked perfectly, and it was only $89. An absolute steal... <3 it."
44462,This phone worked great and arrived in a timely manner
58904,"It was delivered before the expected date of shipment and in mint condition! I couldn't believe that this high tech device was selling for such a low price! I also downloaded the beta android Q software which is a free software option, and has no defects so far. Very impressed!"
47576,"For its price, this phone is a steal. I originally purchased a Xiaomi Pocophone F1 and was disappointed, and decided to replace it with the S8+. Its incredible how the S8+ outperforms. I'll list a few things worth considering if you're thinking about getting an S8+. The display's color and contrast are top of the line. I've been using an s9+ for awhile now as my personal phone and had gotten use to its vibrancy and depth, after giving the Pocophone F1 a shot I realize Samsung's AMOLEDs are just out of this world amazing. Granted the F1 is an IPS display, but from a user experience perspective alone the S8+ really delivers if visuals are a priority to you. The S8+'s speed and performance are fantastic. The hardware you get for this price point is amazing, where my S8+ performs about 95% as fast as my S9+ when using demanding software. The phone's glass and metal exterior is very durable, handling drops well and not scratching with common items. I do have one complaint, however: the fingerprint scanner's location is pretty terrible. If you have smaller hands, I imagine it will be difficult to reach. I would have preferred it to be centered below the camera instead of beside it. All in all, for a little under $400 you won't find a phone remotely as exceptional as the S8/S8+. Samsung has always been the go-to name for flagship android devices, and this phone is an example of why that is."
60102,"DO NOT believe those who claim this phone does not get LTE in the US...Amazon has for some reason a few bad sellers, selling fakes or perhaps the XT1803, which is the model with mostly international bands, ruining this great phone's rating. I have had the XT1806 32GB version in Lunar Gray for almost 15 months now. It has been a fantastic buy for the $269 I paid. ... On an account direct from TMobile this phone has VoLTE, WiFi calling - all the advertised features. If this phone had wireless charging and a just-slightly better camera, I would pay $499 for it, knowing what I know today. I recently looked at LG V35, Samsung 8+ (used), to replace my wife's Samsung J7, but the clearance on G5s Plus at $209 was our choice. Rock solid construction, great speaker phone , Android 8.1, .....just a real deal. PS: The G5s Plus is a better phone than even the $459 LG G7 I just checked yesterday and had thought it was going to be fantastic. Nope - low volume speakers with tinny sound, very easily cracked body, not much better camera, even goes into looping on startup according to a lot of reviewers."
36341,"These phones were not unlocked but preloaded for Att. Which means they were completely useless with my phone plan. They seemed to be as advertised otherwise, but considering the entire reson I bought was for the unlock, I am pretty mad. Now I have to go through the headache of getting another new phone. Plus I have to listen to my wife tell me she was right and thay we should have just bought our phones in store full of bloat ware."
4707,"I've had android and iOS, and I finally made the switch to Windows Phone last year with the HTC 8x. I immediately fell in love with the OS, but was nor impressed with HTC's quality. The Nokia Lumia 928 is exactly what I was looking for! Superior screen resolution, camera and on board storage, not to mention all of the Nokia specific apps. If you want WP on Verizon, this is it. If you're on iOS or android, give WP a try. You won't be disappointed. Nokia Lumia 928, White (Verizon Wireless)"
23602,Great phone. Came in great shape. Don't try to get a SIM by calling Sprint. Goto a Sprint store with a service center.now that I have the SIM. Works great.love this phone.
24599,Bought it as a gift and so far it has worked perfectly fine.
60025,Phone works great my daughter was happy to get this for Christmas.
11683,"I love the phone itself, but the back part has already cracked. I literally had it in my case the whole time and took it out so i could check on it and it was broken on the back in two spots. I guess that means it isn't waterproof now but its still the phone i really wanted so im not sending it back."
15175,this is the best phone I've ever owned I love all the features you should get it!!!
12119,"Love the phone for the most part. I can't do a 5 star because there a FEW things that could be done better/different. I wish the back cover actually screwed on instead of snapping in place like the ""regular"" S5. The home/volume/activity key is little too easy to press for me. If it were in a case it would be perfect, but if you plan on not using a case like me just know that the buttons on the side are very easy to press. Not a problem for me until I have headphones plugged in and I go to put the phone back in my pocket with the headphone jack facing up so I don't bend or break the cable. Normally the phone goes in my pocket with the jack facing down and screen toward my leg so this isn't a factor."
57429,"Do not buy. It isn’t fully unlocked. I got sent 2 phones that were still locked to Verizon, and after calling the company they never answered. Amazon ended up sending me a replacement after the first phone failed to work with my carrier, and it was still unable to support it. Very disappointed and not worth the headache."
67576,"Stock Android is better than bloatware filled alternatives, but a simple dark mode would have been appreciated. The hardware inside doesn't age well and the phone feels slow just 6 months later. Horrendous proximity sensor and it has some annoying bugs and random lag as time goes on. It's better to spend a bit more on their Pocophone F1 which is way better value for the money."
70756,I have no complaints love this phone 😍 5 stars Amazon
61247,"I'm going middle of the road. Battery life, rugged design (friends and co workers thought the phone had a case), and a pure upgrade to the S7 active were all pluses. However, the phone kept resetting itself. I looked online and on Youtube to see if the problem could be solved on my end, because operator error is a thing, and I took the steps necessary to see if it solved the problem. Unfortunately it did not. If there is a takeaway from my this report is to check the warranty and turn it in if you buy one and experience this issue. I didn't look and was too late when I found out and am stuck with this phone. Keep in mind, again, this is a good phone. However the one I bought had a tendency to reset itself over and over again. If your phone does this, send it back. Don't make my mistake."
51132,"I was very impressed when I unwrapped the mini 4. There wasn’t a mark on it! It was charged at 92% and turned on without incident. I plan to use it for drone flying only. I loaded the app I needed, all is well. I’ve have used it to fly several times and am very pleased. The only odd part is the charging. I connected to the same lightening cable I use for my phone and it stopped at 85%. After a little research I used a new charger and cable I already had and it went to 100% no problem."
28507,"My old S7 was glitchy and had a lot of battery drain although the device maintenance said that it was excellent. So I got this S7. Unfortunately this phone is the same or worse. Glitchy, cannot download updates, excessive battery drain. Piece of crap. Supposed to be new but still sucks. Definitely NOT WORTH THE MONEY."
23462,"Excellent phone, great connectivity and sound quality. I've been told on the other side of phone conversations about the clarity of sound when I use this phone. I utilize 2 phones this Note 5 and a Samsung Galaxy S6, one for business and the other for personal use. Also an important distinction is the battery life of the Note vs the S6, the Note has up to 2.5× more use time than the S6. I plan on selling my S6 and purchasing another Note 5, I highly recommend this phone."
42236,"This was the 2nd phone I purchased from Mywit. I bought this one because the first one didn't work. This one had a bad mother bored I guess. That's what Mywit said it sounded like because it kept shutting down. There return policy is horrible. They only do what they said they were gonna do on the phone after you send a message to them through the Amazon system. Then are sure to say in the message. ""We already"" no you did not you did it after. Time stamps. Anyhow. Don't buy from Mywit."
49579,"I bought this for my wife last July and it work until last last Monday when the home button and the right button stopped working. I did some troubleshooting and called Nokia, nothing. I called Amazon and after 50 minutes troubleshooting the device Amazon offered me $100 less than what I paid. I have never given a bad review or had issues with Amazon before. This is unacceptable."
5044,I think for the price this is a great deal and it is a great cell phone Ive had no problems with it at all. Thanks
59891,"Product stated it was a Verizon phone, however I received a Tmobile phone. Still works on my network but not as well. I am unable to use many features/apps that would be on a verizon phone. (Verified TMobile via Samsung)"
53367,"Sim tray came bent, but I repaired it to get t working."
27322,"I dislike the fact that my phone is not working properly. When I make a call, it calls someone I didn't click. Other Strang actions have been happening, I can't even explain."
2138,"I bought this phone for my 85 year old father. He doesn't quite understand it, but it was easier for him to understand than a android phone. We used this phone as an ATT Go-Phone. No problems there."
8613,Battery losing ability to charge. Want a new battery under warranty send yours in and wait 10 days for us to send you one. No way to swap. Samsung has terrible customer service. I have a large number of Samsung products but this is the last one. Any time there is an issue with any of their products it is essentially the customer's problem.
33410,Totally awesome phone. Can't say anything bad about it. 1price can't belive it phone has curved glass display bright beautiful. Camera haven't seen a better one had a iPhone 6plus s. This phone is better. Fast processor great buy this or the xz if you want a smaller one. If sony would advertise and had there phones in all the cell stores there would be no Samsung or Apple. Premium phone at a cheap price.
35909,I like it but I bought it used. Sometimes you can't call out or get calls but I pain $277 for it so it works great for what I paid. I am thinking of buying a new (not used)one because it is a great phone.
70686,If the the refurbish card didn't come inside the box I would of honestly thought it was new. It looks great.
53001,Received the phone and it is locked to T-mobile... I have boost. Don’t buy if you don’t want to go through any problems.
22989,"Bought this from Topshop direct. Details were used like new, in box. The only thing wrong with it was a few peck marks on the screen, but after installing a screen protector you can't even see them at all. It is GSM unlocked, not bootloader unlocked (att). Phone works great with no problems. Do not like--nonremovable battery, no sd card slot, surely a Samsung goof up. Good purchase, definitely satisfied."
24758,Amazing if I knew I wouldon't get another one.. Will buy again for sure. Packaging could have little more protection so box with phone will not bounce around. Otherwise amazing
46714,The phone that I bought is no good it goes off by itself and stay off for hours
78338,"I hesitated a ton buying this phone renewed, constantly reading other reviews, videos about buying Iphones online but I finally decided to go through with it since I had Amazon's return policy to give me confidence. Once I received the package, I found I had nothing to worry about at all, it arrived in amazing condition, with a charger and wall adapter; I would recommend buying Amazon renewed Iphones to anyone now, no regrets whatsoever and I saved money!"
44560,Got this phone and right out of the box it won't charge. This is not acceptable
57775,"Phone came shipped with a glass screen protector which is a nice touch. Product was everything I expected, IOS says battery health is at 88% which is normal considering it’s age, overall very pleased with my purchase. Will definitely be buying from this merchant again when I need a new phone."
46831,"This phone is amazing! Battery lasts forever, pictures are amazing, and the phone is extremely fast. I would (and have) recommend this phone to everyone looking for a new phone at a perfect price. The only issue I have found is the phone screen smudges easily but is corrected by a simple phone screen."
57254,was pretty scared to order this phone but very satisfied when i received
33396,"Didn't buy this on Amazon, happened to have a coupon for Best Buy and decided to get it there. I really wanted to love this phone, but I had so many issues. Pro's: liked the camera 21MP, loved the large display Con's: Heavier than most phones, issue with it switching networks sometimes little to no signal, when my husband's phone on the same plan/network has a full LTE signal. Consistent Bluetooth issues, it initially pairs easily but regularly has connectivity issues. Not waterproof, a lot of bloat ware that takes up the majority of the memory. I'm disappointed because I expected a lot more from Sony and thought I could hold on to this phone for a while, but now I'm on the lookout for another reasonably priced unlocked phone."
63259,Works great with Verizon and T mobile . This phone is totally amazing . Great value !
42380,Fast delivery and arrived in perfect shape. Two differences between this and a new iPHone... The Cost! and the word Refurbished. Update... have now bought 3 of them and all were and still are perfect.
42407,Works perfectly. When I got it the ends of the screen would click but don't anymore. Mod attatchments work perfectly.
47666,tried to trade in the phone to Samsung for a credit. The phone came up as blacklisted meaning the device was reported lost or stolen. WTF
36501,The iPhone is excellent. I had my doubts about buying a refurbished phone but it looks perfectly new. The only issue is that I didn't get earpods with my iPhone. Although i'm not sure if refurbished phones come with earpodes.
80809,I GOT BRAND NEW SAMSUNG GALAXY M30 WITH 128GM FREE EXCELLENT PHONE $229
32314,"Phone came in new condition in the original box with USB data cable and charging block. It was clean and was factory reset. Installed my AT&T sim card and received service without any issues. The Samsung Galaxy S7 Edge is a beautiful phone. Unfortunately, it is a fingerprint magnet! It is also very slippery so dropping it is inevitable without a skin or a case. Installing a skin prevents the slippage but takes away from the aesthetics. You could install a clear case but that adds bulk. Since it has a curved display, the screen cracks easily. The back of the phone is worse since its just regular glass. If you purchase this phone, be gentle. If you are prone to dropping your phone, look elsewhere."
78624,This phone is unlocked and works great my carriers that I have when I'm travelling through the countryside . I do not know what these other buyers are talking about saying it is locked. 100% recommend this product. 😀
70610,"I like the phone itself. However it's broken. This phone does not work properly. Im very dissapointed!! First of all, this phone was advertised as being "" Unlocked "" however its locked with AT&T. I can't believe it ya'll. Let me tell you something else wrong. Every now and then through out the day it will start playing a weird sound. It sounds like an airhorn. Then after, it will start glitching and shuts off. ALSO it powers on and off through out the day non stop. You cant use it because once you try to do something it starting blowing an alarm and power on and off every few seconds. I was so excited for this phone to come in the mail. Now i have to exchange. I'm not sure if that was a good choice because they might send me another broke phone. But i'm going to try. Ya'll say a prayer. I got the phone next to me. It's shutting on and off right now while i'm typing this. Completely disappointing It was shuttering and make horn noises. I cant believe this. Isn't this phone suppose to be in ""new' condition. So disappointed. SMH"
53874,Since I purchased a refurbished Note8 I was apprehensive about the condition it would be in when I got it. If I didn't know it was refurbished I would have believed it was new. What a pleasant surprise !
44956,"Came in 3days looks brand new took it to metro,pcs. They hooked it in 10min. No problems Verry Happy with My iphone SE."
